ID,Title,Authors,Source,Journal,Database,Type,Language,Publication year,Descriptor(s),Publication Country,Fulltext URL, Abstract,Entry Date,Volume number,Issue number,DOI
"155135","Nitazoxanide/azithromycin combination for COVID-19: A suggested new protocol for early management.","Kelleni, Mina T","Pharmacol Res;157: 104874, 2020 07. ","Pharmacol Res","MEDLINE","article","en","2020","","NL","https://dx.doi.org/10.1016/j.phrs.2020.104874","Azithromycin has been shown to have a clinical efficacy against severe acute respiratory syndrome coronavirus 2; ivermectin has also demonstrated a remarkable experimental efficacy with a potential to be used for Coronavirus disease 2019. Further, BCG vaccination is being considered for clinical trials aiming to test its potential for lowering COVID-19 morbidity and mortality. This article illustrates some structural and functional relationships that may gather these drugs and the author, basing on a combined pathophysiological and pharmacological approach, recommends the FDA-approved antidiarrhea drug; nitazoxanide, which has been previously suggested but unfortunately widely ignored, to be tested in combination with azithromycin for their potential activity against SARS CoV-2, soonest. The author also recommends testing their combined administration as early during the clinical course of COVID-19 as possible. Further, basing on the same represented concept, the author suggests more trials for interferons to be tested against SARS CoV-2, especially in severe and critical COVID-19 cases.",20200504,157,, 
"154900","Assessment of QT Intervals in a Case Series of Patients With Coronavirus Disease 2019 (COVID-19) Infection Treated With Hydroxychloroquine Alone or in Combination With Azithromycin in an Intensive Care Unit.","Bessière, Francis; Roccia, Hugo; Delinière, Antoine; Charrière, Rome; Chevalier, Philippe; Argaud, Laurent; Cour, Martin","JAMA Cardiol;2020 May 01. ","JAMA cardiol. (Online)","MEDLINE","article","en","2020","","US","https://dx.doi.org/10.1001/jamacardio.2020.1787","",20200504,,, 
"154898","Risk of QT Interval Prolongation Associated With Use of Hydroxychloroquine With or Without Concomitant Azithromycin Among Hospitalized Patients Testing Positive for Coronavirus Disease 2019 (COVID-19).","Mercuro, Nicholas J; Yen, Christina F; Shim, David J; Maher, Timothy R; McCoy, Christopher M; Zimetbaum, Peter J; Gold, Howard S","JAMA Cardiol;2020 May 01. ","JAMA cardiol. (Online)","MEDLINE","article","en","2020","","US","https://dx.doi.org/10.1001/jamacardio.2020.1834","Importance: Administration of hydroxychloroquine with or without azithromycin for the treatment of coronavirus disease 2019 (COVID-19)-associated pneumonia carries increased risk of corrected QT (QTc) prolongation and cardiac arrhythmias. Objective: To characterize the risk and degree of QT prolongation in patients with COVID-19 in association with their use of hydroxychloroquine with or without concomitant azithromycin. Design, Setting, and Participants: This was a cohort study performed at an academic tertiary care center in Boston, Massachusetts, of patients hospitalized with at least 1 positive COVID-19 nasopharyngeal polymerase chain reaction test result and clinical findings consistent with pneumonia who received at least 1 day of hydroxychloroquine from March 1, 2020, through April 7, 2020. Main Outcomes and Measures: Change in QT interval after receiving hydroxychloroquine with or without azithromycin; occurrence of other potential adverse drug events. Results: Among 90 patients given hydroxychloroquine, 53 received concomitant azithromycin; 44 (48.9%) were female, and the mean (SD) body mass index was 31.5 (6.6). Hypertension (in 48 patients [53.3%]) and diabetes mellitus (in 26 patients [28.9%]) were the most common comorbid conditions. The overall median (interquartile range) baseline QTc was 455 (430-474) milliseconds (hydroxychloroquine, 473 [454-487] milliseconds vs hydroxychloroquine and azithromycin, 442 [427-461] milliseconds; P &lt; .001). Those receiving concomitant azithromycin had a greater median (interquartile range) change in QT interval (23 [10-40] milliseconds) compared with those receiving hydroxychloroquine alone (5.5 [-15.5 to 34.25] milliseconds; P = .03). Seven patients (19%) who received hydroxychloroquine monotherapy developed prolonged QTc of 500 milliseconds or more, and 3 patients (3%) had a change in QTc of 60 milliseconds or more. Of those who received concomitant azithromycin, 11 of 53 (21%) had prolonged QTc of 500 milliseconds or more and 7 of 53 (13 %) had a change in QTc of 60 milliseconds or more. The likelihood of prolonged QTc was greater in those who received concomitant loop diuretics (adjusted odds ratio, 3.38 [95% CI, 1.03-11.08]) or had a baseline QTc of 450 milliseconds or more (adjusted odds ratio, 7.11 [95% CI, 1.75-28.87]). Ten patients had hydroxychloroquine discontinued early because of potential adverse drug events, including intractable nausea, hypoglycemia, and 1 case of torsades de pointes. Conclusions and Relevance: In this cohort study, patients who received hydroxychloroquine for the treatment of pneumonia associated with COVID-19 were at high risk of QTc prolongation, and concurrent treatment with azithromycin was associated with greater changes in QTc. Clinicians should carefully weigh risks and benefits if considering hydroxychloroquine and azithromycin, with close monitoring of QTc and concomitant medication usage.",20200504,,, 
"32352944","Mozliwosci kontrolowania zakazenia nowym wirusem Corona ­ 2019-nCoV./ [Options for controlling new Corona virus infection - 2019-nCoV].","Plusa, Tadeusz","Pol Merkur Lekarski;48(284): 112-119, 2020 Apr 22. ","Pol Merkur Lekarski","MEDLINE","article","pl","2020","Betacoronavirus/pathogenicity; Coronavirus Infections; Coronavirus; Pandemics; Pneumonia, Viral; Animals; Betacoronavirus/drug effects; Coronavirus Infections/drug therapy; Coronavirus Infections/epidemiology; Coronavirus Infections/transmission; Crew Resource Management, Healthcare; Humans; Peptidyl-Dipeptidase A/metabolism; Pneumonia, Viral/drug therapy; Pneumonia, Viral/epidemiology; Pneumonia, Viral/transmission","PL","","According to the Situation Report 65 of the World Health Organization of March 25, 2020, the COVID-19 incidence rate indicates 413 467 confirmed cases and 18 433 deaths. Genetic diversification of the Corona virus has resulted in strains that cause severe respiratory tract infections in humans via drip and animal mediation. S-proteins covering its surface, which bind to the cell receptor - angiotensin converting enzyme 2 (ACE-2) and transmembrane serine protease (TMPRSS2) are important in shaping virus activity. The course of infection varies from mild to severe. The ability to control infection is limited because there are no drugs that fully inhibit 2019-nCoV. Interferon-alpha (5 million U twice daily by inhalation), lopinavir/ritonavir (400/100 mg twice daily orally), as well as chloroquine (500 mg twice daily orally for 10 days) and azithromycin (500 mg twice per day) cause a milder course of the disease and reduce the duration of treatment. The administration of glucocorticosteroids and research drugs (tocilizumab) is acceptable for massive infiltrative lesions in the pulmonary parenchyma causing severe lung injury (ALI) and acute respiratory distress syndrome (ARDS). In the system operation it is necessary to create the socalled a safety matrix that would take into account the existing threat on the one hand and all available services and resources on the other. Precise analysis and separation of individual tasks can enable the creation of a real crisis management plan.",20200504,48,284, 
"32358952","COVID-19 and Fake News in the Dominican Republic.","Tapia, Leandro","Am J Trop Med Hyg;102(6): 1172-1174, 2020 06. ","Am J Trop Med Hyg","MEDLINE","article","en","2020","Antiviral Agents/therapeutic use; Betacoronavirus/pathogenicity; Coronavirus Infections/epidemiology; Pandemics; Pneumonia, Viral/epidemiology; Social Media/ethics; Antibodies, Monoclonal, Humanized/therapeutic use; Antiviral Agents/supply &amp;amp; distribution; Azithromycin/supply &amp;amp; distribution; Azithromycin/therapeutic use; Betacoronavirus/drug effects; Civil Disorders; Coronavirus Infections/drug therapy; Coronavirus Infections/economics; Dissent and Disputes; Dominican Republic/epidemiology; Drug Repositioning; Humans; Hydroxychloroquine/supply &amp;amp; distribution; Hydroxychloroquine/therapeutic use; Ivermectin/supply &amp;amp; distribution; Ivermectin/therapeutic use; Pandemics/economics; Pneumonia, Viral/drug therapy; Pneumonia, Viral/economics; Politics; Public Health/economics; Public Health/trends; Trust/psychology","US","https://dx.doi.org/10.4269/ajtmh.20-0234","The first case of novel coronavirus disease (COVID-19) in the Dominican Republic coincided with a period of political crisis. Distrust in governmental institutions shaped the critical phase of early response. Having a weak public health infrastructure and a lack of public trust, the Ministry of Health (MoH) began the fight against COVID-19 with a losing streak. Within 45 days of the first reported case, the political crisis and turmoil caused by &quot;fake news&quot; are limiting the capacity and success of the MoH response to the pandemic.",20200504,102,6, 
"143891","COVID-19 and (hydroxy)chloroquine-azithromycin combination: Should we take the risk for our patients?","Javelot, Hervé; El-Hage, Wissam; Meyer, Guillaume; Becker, Guillaume; Michel, Bruno; Hingray, Coraline","Br J Clin Pharmacol;86(6): 1176-1177, 2020 06. ","Br J Clin Pharmacol","MEDLINE","article","en","2020","Azithromycin/administration &amp;amp; dosage; Chloroquine/administration &amp;amp; dosage; Coronavirus Infections/drug therapy; Hydroxychloroquine/administration &amp;amp; dosage; Pneumonia, Viral/drug therapy; Azithromycin/adverse effects; Chloroquine/adverse effects; Coronavirus Infections/epidemiology; Drug Therapy, Combination; Humans; Hydroxychloroquine/adverse effects; Long QT Syndrome/chemically induced; Long QT Syndrome/epidemiology; Mental Disorders/complications; Pandemics; Pneumonia, Viral/epidemiology; Risk Factors","GB","https://dx.doi.org/10.1111/bcp.14335","",20200501,86,6, 
"142696","Chloroquine as a prophylactic agent against COVID-19?","Gendrot, Mathieu; Javelle, Emilie; Clerc, Axelle; Savini, Hélène; Pradines, Bruno","Int J Antimicrob Agents;55(6): 105980, 2020 Jun. ","Int J Antimicrob Agents","MEDLINE","article","en","2020","Antiviral Agents/therapeutic use; Betacoronavirus/drug effects; Chloroquine/therapeutic use; Coronavirus Infections/prevention &amp;amp; control; Hydroxychloroquine/therapeutic use; Pandemics/prevention &amp;amp; control; Pneumonia, Viral/prevention &amp;amp; control; Pre-Exposure Prophylaxis/methods; Animals; Antimalarials/therapeutic use; Azithromycin/therapeutic use; Chlorocebus aethiops; Coronavirus Infections/drug therapy; Drug Therapy, Combination; Humans; Pneumonia, Viral/drug therapy; Vero Cells","NL","https://dx.doi.org/10.1016/j.ijantimicag.2020.105980","",20200501,55,6, 
"141768","An evaluation of co-use of chloroquine or hydroxychloroquine plus azithromycin on cardiac outcomes: A pharmacoepidemiological study to inform use during the COVID19 pandemic.","Vouri, Scott M; Thai, Thuy N; Winterstein, Almut G","Res Social Adm Pharm;2020 Apr 30. ","Res. soc. adm. pharm","MEDLINE","article","en","2020","","US","https://dx.doi.org/10.1016/j.sapharm.2020.04.031","BACKGROUND: Chloroquine or hydroxychloroquine (chloroquine) plus azithromycin is considered as therapy for COVID-19. With benefit evaluations underway, safety concerns due to potential additive effects on QTc prolongation should be addressed. OBJECTIVE: We compared risk of cardiac adverse events between combinations of chloroquine and azithromycin and chloroquine and amoxicillin. METHODS: We conducted a retrospective cohort study using the IBM MarketScan Commercial Claims and Medicare Supplemental Databases, 2005-2018. We included autoimmune disease patients aged &amp;#8805;18 years initiating azithromycin or amoxicillin for &amp;#8805;5 days during chloroquine treatment. Patients had continuous insurance coverage &amp;#8805;6 months before combination use until 5 days thereafter or inpatient death. Two outcomes were sudden cardiac arrest/ventricular arrhythmias (SCA/VA) and cardiac symptoms. We followed patients for up to 5 days to estimate hazard ratios (HR). Covariates were adjusted using stabilized inverse probability treatment weighting. RESULTS: We identified two SVC/VA events among &gt;145,000 combination users. The adjusted incidence of cardiac symptoms among azithromycin and amoxicillin users was 276 vs 254 per 10,000 person-years with an adjusted HR of 1.10 (95%CI, 0.62-1.95). CONCLUSION: Combination use of chloroquine and azithromycin at routine doses did not show pronounced increases in arrhythmias in this real-world population, though small sample size and outcome rates limit conclusions.",20200430,,, 
"141760","An independent appraisal and re-analysis of hydroxychloroquine treatment trial for COVID-19.","Intson, Katheron; Kumar, Sachin; Botta, Amy; Neckles, Rachael; Leung, Connie; Jawaid, Ali","Swiss Med Wkly;150: w20262, 2020 04 20. ","Swiss Med Wkly","MEDLINE","article","en","2020","Clinical Trials as Topic; Coronavirus Infections/drug therapy; Hydroxychloroquine/therapeutic use; Pneumonia, Viral/drug therapy; Adult; Azithromycin/therapeutic use; Betacoronavirus; Data Accuracy; Drug Synergism; Drug Therapy, Combination; France; Humans; Middle Aged; Pandemics; Research Design","CH","https://dx.doi.org/10.4414/smw.2020.20262","",20200430,150,, 
"141719","Effect of Chloroquine, Hydroxychloroquine, and Azithromycin on the Corrected QT Interval in Patients With SARS-CoV-2 Infection.","Saleh, Moussa; Gabriels, James; Chang, David; Soo Kim, Beom; Mansoor, Amtul; Mahmood, Eitezaz; Makker, Parth; Ismail, Haisam; Goldner, Bruce; Willner, Jonathan; Beldner, Stuart; Mitra, Raman; John, Roy; Chinitz, Jason; Skipitaris, Nicholas; Mountantonakis, Stavros; Epstein, Laurence M","Circ Arrhythm Electrophysiol;13(6): e008662, 2020 06. ","Circ Arrhythm Electrophysiol","MEDLINE","article","en","2020","","US","https://dx.doi.org/10.1161/CIRCEP.120.008662","BACKGROUND: The novel SARS-CoV-2 (severe acute respiratory syndrome coronavirus 2) is responsible for the global coronavirus disease 2019 pandemic. Small studies have shown a potential benefit of chloroquine/hydroxychloroquine±azithromycin for the treatment of coronavirus disease 2019. Use of these medications alone, or in combination, can lead to a prolongation of the QT interval, possibly increasing the risk of Torsade de pointes and sudden cardiac death. METHODS: Hospitalized patients treated with chloroquine/hydroxychloroquine±azithromycin from March 1 to the 23 at 3 hospitals within the Northwell Health system were included in this prospective, observational study. Serial assessments of the QT interval were performed. The primary outcome was QT prolongation resulting in Torsade de pointes. Secondary outcomes included QT prolongation, the need to prematurely discontinue any of the medications due to QT prolongation, and arrhythmogenic death. RESULTS: Two hundred one patients were treated for coronavirus disease 2019 with chloroquine/hydroxychloroquine. Ten patients (5.0%) received chloroquine, 191 (95.0%) received hydroxychloroquine, and 119 (59.2%) also received azithromycin. The primary outcome of torsade de pointes was not observed in the entire population. Baseline corrected QT interval intervals did not differ between patients treated with chloroquine/hydroxychloroquine (monotherapy group) versus those treated with combination group (chloroquine/hydroxychloroquine and azithromycin; 440.6±24.9 versus 439.9±24.7 ms, P=0.834). The maximum corrected QT interval during treatment was significantly longer in the combination group versus the monotherapy group (470.4±45.0 ms versus 453.3±37.0 ms, P=0.004). Seven patients (3.5%) required discontinuation of these medications due to corrected QT interval prolongation. No arrhythmogenic deaths were reported. CONCLUSIONS: In the largest reported cohort of coronavirus disease 2019 patients to date treated with chloroquine/hydroxychloroquine±azithromycin, no instances of Torsade de pointes, or arrhythmogenic death were reported. Although use of these medications resulted in QT prolongation, clinicians seldomly needed to discontinue therapy. Further study of the need for QT interval monitoring is needed before final recommendations can be made.",20200430,13,6, 
"133079","Antimalarial drugs put to the test for COVID-19","","C&amp;EN Global Enterprise;98(16):11-Nov, 2020.","C&amp;EN Global Enterprise","COVIDWHO","article","","2020","","","https://doi.org/10.1021/cen-09816-buscon2","Over 200,000 people worldwide could receive the old antimalarial drugs chloroquine and hydroxychloroquine across more than 130 clinical trials designed to treat or prevent COVID-19, according to the US clinical trials database  A small study in March suggested that hydroxychloroquine plus the antibiotic azithromycin helped people with COVID-19 recover faster  President Donald J  Trump touted hydroxychloroquine’s potential in the following weeks, spurring huge demand for the drug  While some doctors prescribed it without proof, others scrambled to construct clinical studies to assess the drug’s efficacy  The earliest results are discouraging  A team of investigators in Brazil gave chloroquine to 81 hospitalized patients;32% of those who received high doses died, compared with 15% who received the low dose (medRxiv 2020, DOI: 10 1101/2020 04 07 20056424)  Separately, data analyzed from 368 people with COVID-19 at hospitals run by the US Veterans Health Administration revealed that 28% who received hydroxychloroquine and 22% who got that View: PDF ;Full Text HTML",20200429,,,10.1021/cen-09816-buscon2 
"32337139","Searching an Effective Therapy for the Coronavirus Pandemic: Do We See Light at the End of the Tunnel?","Sharma, Munish; Surani, Salim","Cureus;2020.","Cureus","COVIDWHO","article","","2020","","","https://doi.org/10.7759/cureus.7415","Coronavirus disease 2019 (COVID-19) is an emerging infectious disease caused by severe acute respiratory syndrome coronavirus 2 (SARS-CoV-2)  First reported at the end of December 2019 as a cause for clusters of pneumonia cases in Wuhan city in China, the rapid spread of this condition was declared a pandemic on March 11, 2020, by the World Health Organization (WHO)  Apart from the mortality and morbidity associated with COVID-19, the massive social and financial havoc inflicted by this pandemic has left the entire world pondering if medical science can innovate and curtail the ongoing damage due to SARS-CoV-2  Recent findings of an open-label study that investigated the use of hydroxychloroquine and azithromycin in COVID-19 patients in Marseille, France, has garnered some optimism in scientific quarters and the general public alike in terms of finding a treatment regimen to control the rampant rise of COVID-19  We will discuss the potential off-label therapy and studies as it pertains to COVID-19",20200429,,,10.7759/cureus.7415 
"133393","Viral RNA load as determined by cell culture as a management tool for discharge of SARS-CoV-2 patients from infectious disease wards.","La Scola, Bernard; Le Bideau, Marion; Andreani, Julien; Hoang, Van Thuan; Grimaldier, Clio; Colson, Philippe; Gautret, Philippe; Raoult, Didier","Eur J Clin Microbiol Infect Dis;39(6): 1059-1061, 2020 Jun. ","Eur J Clin Microbiol Infect Dis","MEDLINE","article","en","2020","Betacoronavirus/physiology; Coronavirus Infections/diagnosis; Coronavirus Infections/virology; Patient Discharge; Pneumonia, Viral/diagnosis; Pneumonia, Viral/virology; RNA, Viral/analysis; Viral Load; Animals; Betacoronavirus/isolation &amp;amp; purification; Chlorocebus aethiops; France; Humans; Pandemics; Reverse Transcriptase Polymerase Chain Reaction; Specimen Handling/standards; Vero Cells","DE","https://dx.doi.org/10.1007/s10096-020-03913-9","In a preliminary clinical study, we observed that the combination of hydroxychloroquine and azithromycin was effective against SARS-CoV-2 by shortening the duration of viral load in Covid-19 patients. It is of paramount importance to define when a treated patient can be considered as no longer contagious. Correlation between successful isolation of virus in cell culture and Ct value of quantitative RT-PCR targeting E gene suggests that patients with Ct above 33-34 using our RT-PCR system are not contagious and thus can be discharged from hospital care or strict confinement for non-hospitalized patients.",20200429,39,6, 
"32339832","Inter nation social lockdown versus medical care against COVID-19, a mild environmental insight with special reference to India.","Paital, Biswaranjan; Das, Kabita; Parida, Sarat Kumar","Sci Total Environ;728: 138914, 2020 Aug 01. ","Sci Total Environ","MEDLINE","article","en","2020","","NL","https://dx.doi.org/10.1016/j.scitotenv.2020.138914","Infection by coronavirus (CoV-19) has led to emergence of a pandemic called as Coronavirus Disease (COVID-19) that has so far affected about 210 countries. The dynamic data indicate that the pandemic by CoV-19 so far has infected 2,403,963 individuals, and among these 624,698 have recovered while, it has been fatal for 165,229. Without much experience, currently, the medicines that are clinically being evaluated for COVID-19 include chloroquine, hydroxychloroquine, azithromycin, tocilizumab, lopinavir, ritonavir, tocilizumab and corticosteroids. Therefore, countries such as Italy, USA, Spain and France with the most advanced health care system are partially successful to control CoV-19 infection. India being the 2nd largest populous country, where, the healthcare system is underdeveloped, major portion of population follow unhygienic lifestyle, is able to restrict the rate of both infection and death of its citizens from COVID-19. India has followed an early and a very strict social distancing by lockdown and has issued advisory to clean hands regularly by soap and/or by alcohol based sterilizers. Rolling data on the global index of the CoV infection is 13,306, and the index of some countries such as USA (66,148), Italy (175,055), Spain (210,126), France (83,363) and Switzerland (262,122) is high. The index of India has remained very low (161) so far, mainly due to early implementation of social lockdown, social distancing, and sanitizing hands. However, articles on social lockdown as a preventive measure against COVID-19 in PubMed are scanty. It has been observed that social lockdown has also drastic impacts on the environment especially on reduction of NO2 and CO2 emission. Slow infection rate under strict social distancing will offer time to researchers to come up with exact medicines/vaccines against CoV-19. Therefore, it is concluded that stringent social distancing via lockdown is highly important to control COVID-19 and also to contribute for self-regeneration of nature.",20200429,728,, 
"116929","In vitro testing of combined hydroxychloroquine and azithromycin on SARS-CoV-2 shows synergistic effect.","Andreani, Julien; Le Bideau, Marion; Duflot, Isabelle; Jardot, Priscilla; Rolland, Clara; Boxberger, Manon; Wurtz, Nathalie; Rolain, Jean-Marc; Colson, Philippe; La Scola, Bernard; Raoult, Didier","Microb Pathog;145: 104228, 2020 Aug. ","Microb Pathog","MEDLINE","article","en","2020","Antiviral Agents/pharmacology; Azithromycin/pharmacology; Betacoronavirus/drug effects; Coronavirus Infections/drug therapy; Hydroxychloroquine/pharmacology; Pneumonia, Viral/drug therapy; Animals; Cell Line; Chlorocebus aethiops; Drug Repositioning; Drug Synergism; Drug Therapy, Combination/methods; Humans; Pandemics; Vero Cells; Virus Replication/drug effects","GB","https://dx.doi.org/10.1016/j.micpath.2020.104228","Human coronaviruses SARS-CoV-2 appeared at the end of 2019 and led to a pandemic with high morbidity and mortality. As there are currently no effective drugs targeting this virus, drug repurposing represents a short-term strategy to treat millions of infected patients at low costs. Hydroxychloroquine showed an antiviral effect in vitro. In vivo it showed efficacy, especially when combined with azithromycin in a preliminary clinical trial. Here we demonstrate that the combination of hydroxychloroquine and azithromycin has a synergistic effect in vitro on SARS-CoV-2 at concentrations compatible with that obtained in human lung.",20200427,145,, 
