ID,Title,Authors,Source,Journal,Database,Type,Language,Publication year,Descriptor(s),Publication Country,Fulltext URL, Abstract,Entry Date,Volume number,Issue number,DOI
"276406","Novel coronavirus-related acute respiratory distress syndrome in a patient with twin pregnancy: A case report.","Mehta, Harsh; Ivanovic, Sasa; Cronin, Amanda; VanBrunt, Lindsey; Mistry, Nirav; Miller, Richard; Yodice, Paul; Rezai, Fariborz","Case Rep Womens Health;: e00220, 2020 May 16. ","Case Rep Womens Health","MEDLINE","article","en","2020","","NL","https://dx.doi.org/10.1016/j.crwh.2020.e00220","We present the case of a 39-year-old woman, G1P0, who had conceived twins via in-vitro fertilization, who presented at 27â¯weeks of gestation with nasal congestion and dry cough for 7â¯days. On presentation, her physical examination was benign, except for sinus tachycardia, and she was oxygenating adequately on room air. Laboratory studies were unremarkable, except a PCR test positive for SARS-COV2, and a CT scan of her chest showed bilateral multi-focal ground-glass opacities. A fetal non-stress test was reassuring. She was treated with intravenous fluids, ceftriaxone, azithromycin, and hydroxychloroquine. During her hospital stay, she developed progressively worsening respiratory failure, initially requiring non-invasive ventilation, and subsequently progressed to acute respiratory distress syndrome requiring mechanical ventilation. She then suffered from sudden hypoxemia and hemodynamic collapse, on maximal ventilatory support, prompting an emergency cesarean section at bedside. This led to rapid stabilization of hemodynamic parameters, and of her overall respiratory status. Both the twins were born prematurely, and one of them tested positive for SARS-COV2.",20200518,,, 
"276042","Considerations for Drug Interactions on QTc Interval in Exploratory COVID-19 Treatment.","Roden, Dan M; Harrington, Robert A; Poppas, Athena; Russo, Andrea M","J Am Coll Cardiol;75(20): 2623-2624, 2020 05 26. ","J Am Coll Cardiol","MEDLINE","article","en","2020","Azithromycin/adverse effects; Betacoronavirus/drug effects; Hydroxychloroquine/adverse effects; Long QT Syndrome/chemically induced; Torsades de Pointes/chemically induced; Anti-Bacterial Agents/adverse effects; Anti-Bacterial Agents/metabolism; Antirheumatic Agents/adverse effects; Antirheumatic Agents/metabolism; Antiviral Agents/adverse effects; Antiviral Agents/metabolism; Azithromycin/metabolism; Betacoronavirus/metabolism; Coronavirus Infections/drug therapy; Coronavirus Infections/metabolism; Drug Interactions/physiology; Drug Repositioning/methods; Electrocardiography/drug effects; Electrocardiography/methods; Humans; Hydroxychloroquine/metabolism; Long QT Syndrome/metabolism; Torsades de Pointes/metabolism; Torsades de Pointes/physiopathology","US","https://dx.doi.org/10.1016/j.jacc.2020.04.016","",20200518,75,20, 
"32405877","A Review: Does Complement or the Contact System Have a Role in Protection or Pathogenesis of COVID-19?","Maglakelidze, Natella; Manto, Kristen M; Craig, Timothy J","Pulm Ther;2020 May 13. ","","MEDLINE","article","en","2020","","US","https://dx.doi.org/10.1007/s41030-020-00118-5","INTRODUCTION: COVID-19 presentation may include a profound increase in cytokines and associated pneumonia, rapidly progressing to acute respiratory distress syndrome (ARDS). This so-called cytokine storm often leads to refractory edema, respiratory arrest, and death. At present, anti-IL-6, antiviral therapy, convalescent plasma, hydroxychloroquine, and azithromycin among others are being investigated as potential treatments for COVID-19. As the disease etiology and precise therapeutic interventions are still not definitively defined, we wanted to review the roles that complement and the contact system may have in either the treatment or pathogenesis of the disease. METHODS: We searched the recent literature (PubMed) on complement and coronavirus; contact system and coronavirus; bradykinin and coronavirus; and angiotensin receptor and coronavirus. The manuscript complies with ethics guidelines and was deemed exempt from institutional review board approval according to Human Subjects Protection Office guidelines. RESULTS: Mouse models are available for the study of coronavirus and complement. Although complement is effective in protecting against many viruses, it does not seem to be protective against coronavirus. C3 knockout mice infected with SARS-CoV had less lung disease than wild-type mice, suggesting that complement may play a role in coronavirus pathogenesis. Some evidence suggests that the observed pulmonary edema may be bradykinin-induced and could be the reason that corticosteroids, antihistamines, and other traditional interventions for edema are not effective. Angiotensin-converting enzyme 2 (ACE2) is a co-receptor for SARS-CoV-2, and studies thus far have not concluded a benefit or risk associated with the use of either ACE-inhibitors or angiotensin receptor antagonists. Activation of complement and the contact system, through generation of bradykinin, may play a role in the SARS-CoV-2-induced pulmonary edema, and our search suggests that further work is necessary to confirm our suspicions.",20200518,,, 
"32414534","Acute meningoencephalitis in a patient with COVID-19.","Chaumont, H; Etienne, P; Roze, E; Couratier, C; Roger, P-M; Lannuzel, A","Rev Neurol (Paris);176(6): 519-521, 2020 06. ","Rev Neurol (Paris)","MEDLINE","article","en","2020","Betacoronavirus; Coronavirus Infections/complications; Meningoencephalitis/etiology; Pneumonia, Viral/complications; Acute Disease; Aged; Anti-Bacterial Agents/therapeutic use; Antimalarials/therapeutic use; Azithromycin/therapeutic use; Coronavirus Infections/drug therapy; Drug Therapy, Combination; Humans; Hydroxychloroquine/therapeutic use; Male; Pandemics; Pneumonia, Viral/drug therapy","FR","https://dx.doi.org/10.1016/j.neurol.2020.04.014","",20200518,176,6, 
"32399456","Arterial Mesenteric Thrombosis as a Complication of SARS-CoV-2 Infection","A Beccara, Lia; Pacioni, Carlotta; Ponton, Sara; Francavilla, Simone; Cuzzoli, Antonio","Eur J Case Rep Intern Med;2020.","Eur J Case Rep Intern Med","COVIDWHO","article","","2020","","","https://doi.org/10.12890/2020_001690","A 52-year-old patient with SARS-CoV-2 was diagnosed with interstitial pneumonia and treated with darunavir/ritonavir, hydroxychloroquine, azithromycin and low molecular weight heparin (LMWH)  After LMWH cessation, he developed superior mesenteric arterial thrombosis  An abdominal CT scan showed arterial thrombosis of vessels efferent of the superior mesenteric artery with bowel distension  COVID-19 may predispose to venous and arterial thromboembolism  Anticoagulation prophylaxis should be considered in hospitalized patients with COVID-19, and potential thromboembolism investigated in each symptomatic patient affected by SARS-CoV-2  LEARNING POINTS: Potential thromboembolism must be investigated in each symptomatic patient with SARS-CoV-2 infection The preventive and therapeutic use of antithrombotic agents should be strongly considered in order to mitigate thrombotic and haemorrhagic events in patients with SARS-CoV-2 infection",20200515,,,10.12890/2020_001690 
"259620","Nitazoxanide/azithromycin combination for COVID-19: A suggested new protocol for early management.","Kelleni, Mina T","Pharmacol Res;157: 104874, 2020 07. ","Pharmacol Res","MEDLINE","article","en","2020","","NL","https://dx.doi.org/10.1016/j.phrs.2020.104874","Azithromycin has been shown to have a clinical efficacy against severe acute respiratory syndrome coronavirus 2; ivermectin has also demonstrated a remarkable experimental efficacy with a potential to be used for Coronavirus disease 2019. Further, BCG vaccination is being considered for clinical trials aiming to test its potential for lowering COVID-19 morbidity and mortality. This article illustrates some structural and functional relationships that may gather these drugs and the author, basing on a combined pathophysiological and pharmacological approach, recommends the FDA-approved antidiarrhea drug; nitazoxanide, which has been previously suggested but unfortunately widely ignored, to be tested in combination with azithromycin for their potential activity against SARS CoV-2, soonest. The author also recommends testing their combined administration as early during the clinical course of COVID-19 as possible. Further, basing on the same represented concept, the author suggests more trials for interferons to be tested against SARS CoV-2, especially in severe and critical COVID-19 cases.",20200515,157,, 
"32394481","Genesis of an emergency public drug information website by the French Society of Pharmacology and Therapeutics during the COVID-19 pandemic.","Larrouquere, Louis; Gabin, Manon; Poingt, Emmanuelle; Mouffak, Amelle; Hlavaty, Alex; Lepelley, Marion; Khouri, Charles; Bellier, Alexandre; Alexandre, Joachim; Bedouch, Pierrick; Bertoletti, Laurent; Bordet, Regis; Bouhanick, Béatrice; Jonville-Bera, Annie-Pierre; Laporte, Silvy; Le Jeunne, Claire; Letinier, Louis; Micallef, Joëlle; Naudet, Florian; Roustit, Matthieu; Molimard, Mathieu; Richard, Vincent; Cracowski, Jean-Luc","Fundam Clin Pharmacol;34(3): 389-396, 2020 Jun. ","Fundam Clin Pharmacol","MEDLINE","article","en","2020","Betacoronavirus/drug effects; Consumer Health Information/methods; Coronavirus Infections; Drug Information Services/organization &amp;amp; administration; Pandemics; Pneumonia, Viral; Societies, Pharmaceutical; Coronavirus Infections/drug therapy; Coronavirus Infections/epidemiology; Coronavirus Infections/virology; France; Humans; Pneumonia, Viral/drug therapy; Pneumonia, Viral/epidemiology; Pneumonia, Viral/virology; Public Health/methods; Social Networking","GB","https://dx.doi.org/10.1111/fcp.12564","On March 16, 2020, the French Society of Pharmacology and Therapeutics put online a national Question and Answer (Q&amp;A) website, https://sfpt-fr.org/covid19 on the proper use of drugs during the COVID-19 pandemic. The working group &#039;Drugs and COVID-19&#039; was composed of a scientific council, an editorial team, and experts in the field. The first questions were posted online during the first evening of home-confinement in France, March 17, 2020. Six weeks later, 140 Q&amp;As have been posted. Questions on the controversial use of hydroxychloroquine and to a lesser extent concerning azithromycin have been the most consulted Q&amp;As. Q&amp;As have been consulted 226 014 times in 41 days. This large visibility was obtained through an early communication on Twitter, Facebook, traditional print, and web media. In addition, an early communication through the French Ministry of Health and the French National Agency for Medicines and Health Products Safety ANSM had a large impact in terms of daily number of views. There is a pressing need to sustain a public drug information service combining the expertise of scholarly pharmacology societies, pharmacovigilance network, and the Ministry of Health to quickly provide understandable, clear, expert answers to the general population&#039;s concerns regarding COVID-19 and drug use and to counter fake news.",20200515,34,3, 
"32398343","Should azithromycin be used to treat COVID-19? A rapid review.","Gbinigie, Kome; Frie, Kerstin","BJGP Open;2020 May 12. ","","MEDLINE","article","en","2020","","GB","https://dx.doi.org/10.3399/bjgpopen20X101094","BACKGROUND: There are no established effective treatments for COVID-19. While novel drugs are being developed, azithromycin has been identified as a candidate treatment in the interim. AIM: To review the evidence for the effectiveness and safety of azithromycin in treating COVID-19. DESIGN &amp; SETTING: A rapid review of the literature was conducted. METHOD: Electronic searches were conducted on 16 April 2020 of PubMed, TRIP, EPPI COVID Living Map, MedRxiv, GoogleScholar, and Google. In vivo and in vitro studies were included assessing the safety and effectiveness of azithromycin for treatment of COVID-19, and/or the activity of azithromycin against SARS-CoV-2. In vivo studies needed to include a comparator group. RESULTS: Three studies were identified, two in vitro and one in vivo, which were suitable for inclusion. All three were published as pre-prints. The in vitro studies revealed conflicting results, with one finding anti-SARS-CoV-2 activity for azithromycin alone, while the other found activity against SARS-CoV-2 only when azithromycin was combined with hydroxychloroquine. A small trial of 36 patients, with high risk of bias, found superior viral clearance in patients with COVID-19 treated with azithromycin and hydroxychloroquine combined, compared with hydroxychloroquine alone. CONCLUSION: There is no evidence to support the use of azithromycin for the treatment of COVID-19 outside of the context of clinical trials, unless it is used to treat bacterial super-infection. There is extremely limited evidence of a possible synergy between azithromycin and hydroxychloroquine. The adverse events profile of azithromycin in the context of COVID-19 has not yet been established. Well-conducted clinical trials are urgently needed in this area.",20200515,,, 
"245620","Synergistic antiviral effect of hydroxychloroquine and azithromycin in combination against SARS-CoV-2: What molecular dynamics studies of virus-host interactions reveal.","Fantini, Jacques; Chahinian, Henri; Yahi, Nouara","Int J Antimicrob Agents;: 106020, 2020 May 13. ","Int J Antimicrob Agents","MEDLINE","article","en","2020","","NL","https://dx.doi.org/10.1016/j.ijantimicag.2020.106020","The emergence of SARS-coronavirus-2 (SARS-CoV-2) has led to a global pandemic disease referred to as coronavirus disease 19 (COVID-19). Hydroxychloroquine (CLQ-OH)/azithromycin (ATM) combination therapy is currently being tested for the treatment of COVID-19, with promising results. However, the molecular mechanism of action of this combination is not yet established. Using molecular dynamics (MD) simulations, this study shows that the drugs act in synergy to prevent any close contact between the virus and the plasma membrane of host cells. Unexpected molecular similarity is shown between ATM and the sugar moiety of GM1, a lipid raft ganglioside acting as a host attachment cofactor for respiratory viruses. Due to this mimicry, ATM interacts with the ganglioside-binding domain of SARS-CoV-2 spike protein. This binding site shared by ATM and GM1 displays a conserved amino acid triad Q-134/F-135/N-137 located at the tip of the spike protein. CLQ-OH molecules are shown to saturate virus attachment sites on gangliosides in the vicinity of the primary coronavirus receptor, angiotensin-converting enzyme-2 (ACE-2). Taken together, these data show that ATM is directed against the virus, whereas CLQ-OH is directed against cellular attachment cofactors. We conclude that both drugs act as competitive inhibitors of SARS-CoV-2 attachment to the host-cell membrane. This is consistent with a synergistic antiviral mechanism at the plasma membrane level, where therapeutic intervention is likely to be most efficient. This molecular mechanism may explain the beneficial effects of CLQ-OH/ATM combination therapy in patients with COVID-19. Incidentally, the data also indicate that the conserved Q-134/F-135/N-137 triad could be considered as a target for vaccine strategies.",20200514,,, 
"245599","Report of 5 nurses infecting COVID-19 during patient care: case Series.","Gheysarzadeh, Ali; Sadeghifard, Nourkhoda; Safari, Maryam; Balavandi, Firooz; Falahi, Shahab; Kenarkoohi, Azra; Tavan, Hamed","New Microbes New Infect;: 100694, 2020 May 13. ","New Microbes New Infect","MEDLINE","article","en","2020","","GB","https://dx.doi.org/10.1016/j.nmni.2020.100694","Background: The high prevalence of COVID-19 has been paied lots of attention all over the world. Nurses are in the first line against this infection and they placed in a high-risk situation. This study aimed to report COVID-19 infection during patients care among nures in the Mostafa Khomini Hospital, Ilam, Iran. In this hospital 125 nurses were enrolled in COVID-19 center. Findings: In the present study 5 out of 125 nurses (4%) who enrolled in COVID-19 infection center, were infected with COVID-19. They were first positive for real-time PCR but the CT scan was positive for just one of them. None of the infected nurses were hospitalized and all of them preferred to be quarantine at home and receive the necessary care and treatment (Oseltamivir, Azithromycin and Kaletra. Conclusion: This study showed that regardless of self caring, the nurses were exposed to COVID-19. Because at the the beginning of SARS-CoV-2 outbreak in Iran, there were no special protection against this infection.Therfore they were at risk for the COVID-19.This study also reported that receiving the necessary care and treatment at home was a good experience for nurses that can be used in some cases.",20200514,,, 
"32391234","A Hemodialysis Patient with Severe COVID-19 Pneumonia","Alalwan, Adel A.; Taher, Abdulraqeeb; Alaradi, Ali H.","Cureus;2020.","Cureus","COVIDWHO","article","","2020","","","https://doi.org/10.7759/cureus.7995","Coronavirus disease 2019 (COVID-19) is an infectious disease caused by a novel coronavirus that has spread rapidly, resulting in a worldwide pandemic  Even though end-stage renal disease (ESRD) patients are particularly susceptible to COVID-19 infection and can develop severe to critical disease, there are limited studies and case reports about COVID-19 in ESRD patients  We report a case of a 63-year-old gentleman with ESRD on regular hemodialysis  We describe the clinical presentation of this patient, the diagnostic process, the laboratory and imaging investigations, as well as the course of treatment  He positively responded to a 14-day course of Lopinavir-Ritonavir, Ribavirin, Azithromycin, and Hydroxychloroquine",20200513,,,10.7759/cureus.7995 
"32392007","Luchtwegklachten in tijden van corona./ [Respiratory complaints in the time of COVID-19].","Loogman, Masja C M; de Jong, Nynke; Platteel, Tamara N; Bouma, Margriet; Verheij, Theo J M; Opstelten, Wim","Ned Tijdschr Geneeskd;1642020 Mar 25. ","Ned. tijdschr. geneeskd","MEDLINE","article","nl","2020","Betacoronavirus; Coronavirus Infections/diagnosis; General Practice; Pneumonia, Viral/diagnosis; Respiratory Tract Infections/virology; Aged, 80 and over; Amoxicillin/therapeutic use; Anti-Bacterial Agents/therapeutic use; Anti-Inflammatory Agents, Non-Steroidal/therapeutic use; Coronavirus Infections/epidemiology; Coronavirus Infections/prevention &amp;amp; control; Female; General Practice/methods; General Practice/standards; Humans; Male; Middle Aged; Pandemics/prevention &amp;amp; control; Pneumonia, Viral/epidemiology; Pneumonia, Viral/prevention &amp;amp; control; Respiratory Tract Infections/drug therapy; Triage","NL","","The current guidelines for diagnosis and treatment of primary respiratory infections are still useful during the COVID-19 epidemic.Telephone triage of patients with respiratory complaints aims to identify patients with complications or an increased risk of complications.There are no indications to test for SARS-CoV-2 virus in general practice.During this COVID-19 epidemic, protective clothing is recommended in all physical contacts with patients with respiratory complaints.There is no reason to be cautious about using NSAIDs in patients suspected of COVID-19.Amoxicillin is first choice treatment for respiratory infections during the COVID-19 epidemic; there is lack of evidence to support azithromycin as a first choice.Respiratory rate &gt; 24 / min or saturation &lt;92-94% indicate imminent respiratory decompensation and may be reasons for referral.",20200513,164,, 
"32392282","Association of Treatment With Hydroxychloroquine or Azithromycin With In-Hospital Mortality in Patients With COVID-19 in New York State.","Rosenberg, Eli S; Dufort, Elizabeth M; Udo, Tomoko; Wilberschied, Larissa A; Kumar, Jessica; Tesoriero, James; Weinberg, Patti; Kirkwood, James; Muse, Alison; DeHovitz, Jack; Blog, Debra S; Hutton, Brad; Holtgrave, David R; Zucker, Howard A","JAMA;2020 May 11. ","JAMA","MEDLINE","article","en","2020","","US","https://dx.doi.org/10.1001/jama.2020.8630","Importance: Hydroxychloroquine, with or without azithromycin, has been considered as a possible therapeutic agent for patients with coronavirus disease 2019 (COVID-19). However, there are limited data on efficacy and associated adverse events. Objective: To describe the association between use of hydroxychloroquine, with or without azithromycin, and clinical outcomes among hospital inpatients diagnosed with COVID-19. Design, Setting, and Participants: Retrospective multicenter cohort study of patients from a random sample of all admitted patients with laboratory-confirmed COVID-19 in 25 hospitals, representing 88.2% of patients with COVID-19 in the New York metropolitan region. Eligible patients were admitted for at least 24 hours between March 15 and 28, 2020. Medications, preexisting conditions, clinical measures on admission, outcomes, and adverse events were abstracted from medical records. The date of final follow-up was April 24, 2020. Exposures: Receipt of both hydroxychloroquine and azithromycin, hydroxychloroquine alone, azithromycin alone, or neither. Main Outcomes and Measures: Primary outcome was in-hospital mortality. Secondary outcomes were cardiac arrest and abnormal electrocardiogram findings (arrhythmia or QT prolongation). Results: Among 1438 hospitalized patients with a diagnosis of COVID-19 (858 [59.7%] male, median age, 63 years), those receiving hydroxychloroquine, azithromycin, or both were more likely than those not receiving either drug to have diabetes, respiratory rate &gt;22/min, abnormal chest imaging findings, O2 saturation lower than 90%, and aspartate aminotransferase greater than 40 U/L. Overall in-hospital mortality was 20.3% (95% CI, 18.2%-22.4%). The probability of death for patients receiving hydroxychloroquine + azithromycin was 189/735 (25.7% [95% CI, 22.3%-28.9%]), hydroxychloroquine alone, 54/271 (19.9% [95% CI, 15.2%-24.7%]), azithromycin alone, 21/211 (10.0% [95% CI, 5.9%-14.0%]), and neither drug, 28/221 (12.7% [95% CI, 8.3%-17.1%]). In adjusted Cox proportional hazards models, compared with patients receiving neither drug, there were no significant differences in mortality for patients receiving hydroxychloroquine + azithromycin (HR, 1.35 [95% CI, 0.76-2.40]), hydroxychloroquine alone (HR, 1.08 [95% CI, 0.63-1.85]), or azithromycin alone (HR, 0.56 [95% CI, 0.26-1.21]). In logistic models, compared with patients receiving neither drug cardiac arrest was significantly more likely in patients receiving hydroxychloroquine + azithromycin (adjusted OR, 2.13 [95% CI, 1.12-4.05]), but not hydroxychloroquine alone (adjusted OR, 1.91 [95% CI, 0.96-3.81]) or azithromycin alone (adjusted OR, 0.64 [95% CI, 0.27-1.56]), . In adjusted logistic regression models, there were no significant differences in the relative likelihood of abnormal electrocardiogram findings. Conclusions and Relevance: Among patients hospitalized in metropolitan New York with COVID-19, treatment with hydroxychloroquine, azithromycin, or both, compared with neither treatment, was not significantly associated with differences in in-hospital mortality. However, the interpretation of these findings may be limited by the observational design.",20200513,,, 
"232791","Biggest COVID-19 trial tests repurposed drugs first.","","Nat Biotechnol;38(5): 510, 2020 05. ","Nat Biotechnol","MEDLINE","article","en","2020","Coronavirus Infections/drug therapy; Drug Repositioning; Pneumonia, Viral/drug therapy; Adaptive Clinical Trials as Topic; Azithromycin/therapeutic use; Betacoronavirus; Dexamethasone/therapeutic use; Drug Combinations; Humans; Hydroxychloroquine/therapeutic use; Lopinavir/therapeutic use; Pandemics; Randomized Controlled Trials as Topic; Ritonavir/therapeutic use; Standard of Care; United Kingdom","US","https://dx.doi.org/10.1038/s41587-020-0528-x","",20200512,38,5, 
"232476","An Update on Current Therapeutic Drugs Treating COVID-19.","Wu, Renyi; Wang, Lujing; Kuo, Hsiao-Chen Dina; Shannar, Ahmad; Peter, Rebecca; Chou, Pochung Jordan; Li, Shanyi; Hudlikar, Rasika; Liu, Xia; Liu, Zhigang; Poiani, George J; Amorosa, Louis; Brunetti, Luigi; Kong, Ah-Ng","Curr Pharmacol Rep;: 1-15, 2020 May 11. ","Curr Pharmacol Rep","MEDLINE","article","en","2020","","CH","https://dx.doi.org/10.1007/s40495-020-00216-7","The current pandemic of coronavirus disease 2019 (COVID-19) caused by severe acute respiratory syndrome coronavirus 2 (SARS-CoV-2) has presented unprecedented challenges to the healthcare systems in almost every country around the world. Currently, there are no proven effective vaccines or therapeutic agents against the virus. Current clinical management includes infection prevention and control measures and supportive care including supplemental oxygen and mechanical ventilatory support. Evolving research and clinical data regarding the virologic SARS-CoV-2 suggest a potential list of repurposed drugs with appropriate pharmacological effects and therapeutic efficacies in treating COVID-19 patients. In this review, we will update and summarize the most common and plausible drugs for the treatment of COVID-19 patients. These drugs and therapeutic agents include antiviral agents (remdesivir, hydroxychloroquine, chloroquine, lopinavir, umifenovir, favipiravir, and oseltamivir), and supporting agents (Ascorbic acid, Azithromycin, Corticosteroids, Nitric oxide, IL-6 antagonists), among others. We hope that this review will provide useful and most updated therapeutic drugs to prevent, control, and treat COVID-19 patients until the approval of vaccines and specific drugs targeting SARS-CoV-2.",20200512,,, 
