ID,Title,Authors,Source,Journal,Database,Type,Language,Publication year,Descriptor(s),Publication Country,Fulltext URL, Abstract,Entry Date,Volume number,Issue number,DOI
"32493475","A randomized multicenter clinical trial to evaluate the efficacy of melatonin in the prophylaxis of SARS-CoV-2 infection in high-risk contacts (MeCOVID Trial): A structured summary of a study protocol for a randomised controlled trial.","García, Irene García; Rodriguez-Rubio, Miguel; Mariblanca, Amelia Rodríguez; de Soto, Lucía Martínez; García, Lucía Díaz; Villatoro, Jaime Monserrat; Parada, Javier Queiruga; Meseguer, Enrique Seco; Rosales, María J; González, Juan; Arribas, José R; Carcas, Antonio J; de la Oliva, Pedro; Borobia, Alberto M","Trials;21(1): 466, 2020 Jun 03. ","Trials","MEDLINE","article","en","2020","Antiviral Agents/administration &amp;amp; dosage; Betacoronavirus/drug effects; Infectious Disease Transmission, Patient-to-Professional/prevention &amp;amp; control; Melatonin/administration &amp;amp; dosage; Occupational Exposure/adverse effects; Occupational Health; Adolescent; Adult; Aged; Aged, 80 and over; Antibodies, Viral/blood; Antiviral Agents/adverse effects; Betacoronavirus/immunology; Betacoronavirus/pathogenicity; Chemoprevention; Coronavirus Infections/blood; Coronavirus Infections/diagnosis; Coronavirus Infections/transmission; Coronavirus Infections/virology; Double-Blind Method; Female; Humans; Male; Melatonin/adverse effects; Middle Aged; Multicenter Studies as Topic; Pandemics; Pneumonia, Viral/blood; Pneumonia, Viral/diagnosis; Pneumonia, Viral/transmission; Pneumonia, Viral/virology; Randomized Controlled Trials as Topic; Risk Assessment; Risk Factors; Seroconversion; Spain; Time Factors; Treatment Outcome; Young Adult","GB","https://dx.doi.org/10.1186/s13063-020-04436-6","OBJECTIVES: Primary objective: to evaluate the efficacy of melatonin as a prophylactic treatment on prevention of symptomatic SARS-CoV-2 infection among healthcare workers at high risk of SARS-CoV-2 exposure. Secondary objectives: To evaluate the efficacy of melatonin as a prophylactic treatment on prevention of asymptomatic SARS-CoV-2 infection.To evaluate the efficacy of melatonin to prevent the development of severe COVID-19 in the participants enrolled in this study who develop SARS-CoV-2 infection along the trial.To evaluate the duration of COVID-19 symptoms in participants receiving melatonin before the infection.To evaluate seroconversion timing post-symptom onset. Exploratory objectives:To compare severity of COVID-19 between men and women.To evaluate the influence of sleep and diet on prevention from SARS-CoV-2 infection.To evaluate the effect of melatonin on the incidence and characteristics of lymphopenia and increase of inflammatory cytokines related to COVID-19. TRIAL DESIGN: This is a two-arm parallel randomised double-blind controlled trial to evaluate the efficacy of melatonin versus placebo in the prophylaxis of coronavirus disease 2019 among healthcare workers. PARTICIPANTS: Inclusion Criteria: Male or female participants &amp;#8805; 18 and &amp;#8804; 80 years of age.Healthcare workers from the public and private Spanish hospital network at risk of SARS-CoV 2 infection.Not having a previous COVID19 diagnosis.Understanding the purpose of the trial and not having taken any pre-exposure prophylaxis (PrEP) including HIV PrEP from March 1st 2020 until study enrolment.Having a negative SARS-CoV 2 reverse-transcription PCR (RT-PCR) result or a negative serologic rapid test (IgM/IgG) result before randomization.Premenopausal women must have a negative urinary pregnancy test in the 7 days before starting the trial treatment.Premenopausal women and males with premenopausal couples must commit to using a high efficiency anticonceptive method. EXCLUSION CRITERIA: HIV infection.Active hepatitis B infection.Renal failure (CrCl &lt; 60 mL/min/1.73 m2) or need for hemodialysis.Osteoporosis.Myasthenia gravis.Pre-existent maculopathy.Retinitis pigmentosa.Bradycardia (less than 50 bpm).Weight less than 40 Kg.Participant with any immunosuppressive condition or hematological disease.Treatment with drugs that may prolong QT in the last month before randomization for more than 7 days including: azithromycin, chlorpromazine, cisapride, clarithromycin, domperidone, droperidol, erythromycin, halofantrine, haloperidol, lumefantrine, mefloquine, methadone, pentamidine, procainamide, quinidine, quinine, sotalol, sparfloxacin, thioridazine, amiodarone.Hereditary intolerance to galactose, Lapp lactase deficiency or glucose or galactose malabsorption.Treatment with fluvoxamine.Treatment with benzodiazepines or benzodiazepine analogues such as zolpidem, zopiclone or zaleplon.Pregnancy.Breastfeeding.History of potentially immune derived diseases such as: lupus, Crohn&#039;s disease, ulcerative colitis, vasculitis or rheumatoid arthritis.Insulin-dependent diabetes mellitus.Known history of hypersensitivity to the study drug or any of its components.Patients that should not be included in the study at the judgment of the research team. Participants will be recruited from the following eight hospitals in Madrid, Spain: Hospital Universitario La Paz, Hospital Ramón y Cajal, Hospital Infanta Sofía, Hospital 12 de Octubre, Hospital Clínico San Carlos, Hospital Central de la defensa Gómez Ulla,Hospital de La Princesa and Hospital Infanta Leonor. INTERVENTION AND COMPARATOR: Experimental: Melatonin (Circadin®, Exeltis Healthcare, Spain): 2 mg of melatonin orally before bedtime for 12 weeks. Comparator: Identical looking placebo (Laboratorios Liconsa, Spain) orally before bedtime for 12 weeks. MAIN OUTCOMES: Number of SARS-CoV-2 (COVID-19) symptomatic infections confirmed by polymerase chain reaction (PCR) test or serologic test or according to each centre diagnosis protocol. Primary outcome will be measured until the end of treatment for each participant (until the date of the last dose taken by each patient). RANDOMISATION: Patients who meet all inclusion and no exclusion criteria will be randomised, stratified by centres, sex and age (&lt;50 and &amp;#8805; 50 years old). The randomisation sequence was created using SAS version 9.4 statistical software (procedure &#039;PROC PLAN&#039;) with a 1:1 allocation. No randomisation seed was specified. The randomisation seed was generated taking the hour of the computer where the program was executed. Randomization will be done centrally through the electronic system RedCAP® in order to conceal the sequence until interventions are assigned BLINDING (MASKING): Participants, caregivers, and those assessing the outcomes are blinded to group assignment. NUMBERS TO BE RANDOMISED (SAMPLE SIZE): A total of 450 participants are planned to be enrolled in this clinical trial, 225 in the experimental arm and 225 in the placebo arm. TRIAL STATUS: Protocol version 3.0, 17th of April 2020. Recruitment ongoing. First participant was recruited on the 21st of April 2020. The final participant is anticipated to be recruited on the 31st of May 2020. As of May 18th, 2020, a total of 312 participants have been enrolled (154 at Hospital La Paz, 85 at Hospital Infanta Sofía and 73 at Hospital 12 de Octubre). TRIAL REGISTRATION: EU Clinical Trials Register: 2020-001530-35; Date of trial registration: 13th of April 2020; https://www.clinicaltrialsregister.eu/ctr-search/trial/2020-001530-35/ES FULL PROTOCOL: The full protocol is attached as an additional file, accessible from the Trials website (Additional file 1). In the interest in expediting dissemination of this material, the familiar formatting has been eliminated; this Letter serves as a summary of the key elements of the full protocol.",20200609,21,1, 
"548604","Outcomes of hydroxychloroquine usage in United States veterans hospitalized with COVID-19","Magagnoli, Joseph; Narendran, Siddharth; Pereira, Felipe; Cummings, Tammy H.; Hardin, James W.; Sutton, S. Scott; Ambati, Jayakrishna","Med;0(0), 2020.","Med","COVIDWHO","article","","2020","","","https://doi.org/10.1016/j.medj.2020.06.001","AbstractBackgroundDespite limited and conflicting evidence, hydroxychloroquine, alone or in combination with azithromycin, is widely used in COVID-19 therapy MethodsWe performed a retrospective study of electronic health records of patients hospitalized with confirmed SARS-CoV-2 infection in United States Veterans Health Administration medical centers between March 9, 2020 and April 29, 2020  Patients hospitalized within 24 hours of diagnosis were classified based on their exposure to hydroxychloroquine alone (HC) or with azithromycin (HC+AZ) or no HC as treatments  The primary outcomes were mortality and use of mechanical ventilation FindingsA total of 807 patients were evaluated  Compared to the no HC group, after propensity score adjustment for clinical characteristics, the risk of death from any cause was higher in the HC group (adjusted hazard ratio (aHR), 1 83;95% CI, 1 16 to 2 89;P=0 009) but not in the HC+AZ group (aHR, 1 31;95% CI, 0 80 to 2 15;P=0 28)  Both the propensity score-adjusted risks of mechanical ventilation and death after mechanical ventilation were not significantly different in the HC group (aHR, 1 19;95% CI, 0 78 to 1 82;P=0 42 and aHR, 2 11;95% CI, 0 96 to 4 62;P=0 06, respectively) or in the HC+AZ group (aHR, 1 09;95% CI, 0 72 to 1 66;P=0 69 and aHR, 1 25;95% CI, 0 59 to 2 68;P=0 56, respectively), compared to the no HC group ConclusionsAmong patients hospitalized with COVID-19, this retrospective study did not identify any significant reduction in mortality or in the need for mechanical ventilation with hydroxychloroquine treatment with or without azithromycin FundingUniversity of Virginia Strategic Investment Fund",20200608,,,10.1016/j.medj.2020.06.001 
"548972","Widely available lysosome targeting agents should be considered as potential therapy for COVID-19.","Homolak, J; Kodvanj, I","Int J Antimicrob Agents;: 106044, 2020 Jun 06. ","Int J Antimicrob Agents","MEDLINE","article","en","2020","","NL","https://dx.doi.org/10.1016/j.ijantimicag.2020.106044","While the coronavirus disease 2019 (COVID-19) pandemic advances, the scientific community continues to struggle in the search for treatments. Several improvements have been made, including discovery of the clinical efficacy of chloroquine (CQ) in patients with COVID-19, but effective treatment protocols remain elusive. In the search for novel treatment options, many scientists have used the in-silico approach to identify compounds that could interfere with the key molecules involved in entrance, replication or dissemination of severe acute respiratory syndrome coronavirus-2. However, most of the identified molecules are not available as pharmacological agents at present, and assessment of their safety and efficacy could take many months. This review took a different approach based on the proposed pharmacodynamic model of CQ in COVID-19. The main mechanism of action responsible for the favourable outcome of patients with COVID-19 treated with CQ seems to be related to a pH-modulation-mediated effect on endolysosomal trafficking, a characteristic of chemical compounds often called &#039;lysosomotropic agents&#039; because of the physico-chemical properties that enable them to diffuse passively through the endosomal membrane and undergo protonation-based trapping in the lumen of the acidic vesicles. This review discusses lysosomotropic and lysosome targeting drugs that are already in clinical use and are characterized by good safety profiles, low cost and wide availability. Some of these drugs -particularly azithromycin and other macrolides, indomethacin and some other non-steroidal anti-inflammatory drugs, proton pump inhibitors and fluoxetine - could provide additional therapeutic benefits in addition to the potential antiviral effect that is still to be confirmed by well-controlled clinical trials. As some of these drugs have probably been used empirically in the treatment of COVID-19, it is hoped that colleagues worldwide will publish patient data to enable evaluation of the potential efficacy of these agents in the clinical context, and rapid implementation in therapeutic protocols if they are shown to have a beneficial effect on clinical outcome.",20200608,,, 
"548703","Outbreak of SARS-CoV2: Pathogenesis of infection and cardiovascular involvement.","Amirfakhryan, Hamideh; Safari, Fatemeh","Hellenic J Cardiol;2020 Jun 06. ","Hell. j. cardiol","MEDLINE","article","en","2020","","NL","https://dx.doi.org/10.1016/j.hjc.2020.05.007","Since the new coronavirus SARS (SARS-CoV2) has emerged from china, the infection (COVID-19) has affected many countries and led to many deaths worldwide. Like SARS-CoV, ACE2 as a functional receptor for SARS-CoV2 is essential for virus to entry to the cell. ACE2 is a part of RAS which is expressed in several organs that opposes the AngII functions by converting Ang II to Ang (1-7), the one with vasodilation effects. The death rate of COVID-19 is estimated about 3.4%, however, some comorbid conditions like underlying cardiovascular disease, hypertension, and diabetes increase the risk of mortality. In addition, cardiovascular involvement by SARS-CoV2 could be direct through either ACE2 receptors which are expressed tremendously in heart, or by the surge of different cytokines or by ARDS-induced hypoxia. Traditional risk factors could aggravate the process of COVID-19 infection that urges the triage of these high risk patients for SARS-CoV2. Currently, there is no effective, proven treatment or vaccination for COVID-19, but many investigators are struggling to find a treatment strategy as soon as possible. Some potential medications like chloroquine by itself or in combination with azithromycin, and some protease inhibitors used for the treatment of COVID-19 have cardiovascular adverse effects that should be kept in mind in order to close monitor of the patients receiving these medications.",20200608,,, 
"32496241","Hydroxychloroquine as prophylaxis or treatment for COVID-19: What does the evidence say?","Nina, Praveen Balabaskaran; Dash, Aditya Prasad","Indian J Public Health;64(Supplement): S125-S127, 2020 Jun. ","Indian J Public Health","MEDLINE","article","en","2020","Antimalarials/therapeutic use; Coronavirus Infections/drug therapy; Hydroxychloroquine/therapeutic use; Pneumonia, Viral/drug therapy; Anti-Bacterial Agents/therapeutic use; Antimalarials/administration &amp;amp; dosage; Antimalarials/adverse effects; Azithromycin/therapeutic use; Betacoronavirus; Drug Therapy, Combination; Humans; Hydroxychloroquine/administration &amp;amp; dosage; Hydroxychloroquine/adverse effects; Pandemics","IN","https://dx.doi.org/10.4103/ijph.IJPH_496_20","Hydroxychloroquine (HCQ), an antimalarial has been proposed as possible treatment for coronavirus disease-2019 (COVID-19). India has approved the use of HCQ for prophylaxis of asymptomatic health workers treating suspected or confirmed COVID-19 cases, and asymptomatic household contacts of confirmed patients. The U.S. Food and Drug Administration has issued Emergency Use Authorization for the use of HCQ to treat COVID-19 in adolescents and adults. In this review, we go over the available evidence for and against HCQ&#039;s use as prophylaxis or treatment for COVID-19, especially in the Indian context.",20200608,64,Supplement, 
"506021","Hydroxychloroquine/ chloroquine as a treatment choice or prophylaxis for Covid-19 at the primary care level in developing countries: A Primum non Nocere dilemma.","Chevalier, Marco T Medina; Moncada, Sir Salvador","J Neurol Sci;415: 116972, 2020 Jun 03. ","J Neurol Sci","MEDLINE","article","en","2020","","NL","https://dx.doi.org/10.1016/j.jns.2020.116972","The Food and Drug Administration (FDA) warned against the use of Hydroxychloroquine or chloroquine for Covid-19 outside of a hospital or a clinical trial setting due to the risk of QT interval prolongation, ventricular tachycardia and the increased risk of these complications when combined with some antibiotics such as azithromycin. Several studies have reported no benefit of Hydroxychloroquine or chloroquine, when used alone or with a macrolide in COVID-19 hospitalized patients. Despite these warnings, in several developing countries the official guidelines for treatment of Covid-19 patients at the primary care level recommend Hydroxychloroquine and azithromycin, among other treatments, as the first-choice for mild symptomatic Covid-19 patients, asymptomatic contacts or for prophylaxis. In our opinion there is a primum non nocere dilemma during this Covid-19 pandemic. In order to solve this bioethical problem, we strongly recommend that a randomized controlled trial in a primary care setting be carried out as a matter of urgency in these areas of the world.",20200604,415,, 
"505746","COVID-19 and cardiac arrhythmias: a global perspective on arrhythmia characteristics and management strategies.","Gopinathannair, Rakesh; Merchant, Faisal M; Lakkireddy, Dhanunjaya R; Etheridge, Susan P; Feigofsky, Suzy; Han, Janet K; Kabra, Rajesh; Natale, Andrea; Poe, Stacy; Saha, Sandeep A; Russo, Andrea M","J Interv Card Electrophysiol;2020 Jun 03. ","J. interv. card. electrophysiol","MEDLINE","article","en","2020","","NL","https://dx.doi.org/10.1007/s10840-020-00789-9","BACKGROUND: Cardiovascular and arrhythmic events have been reported in hospitalized COVID-19 patients. However, arrhythmia manifestations and treatment strategies used in these patients have not been well-described. We sought to better understand the cardiac arrhythmic manifestations and treatment strategies in hospitalized COVID-19 patients through a worldwide cross-sectional survey. METHODS: The Heart Rhythm Society (HRS) sent an online survey (via SurveyMonkey) to electrophysiology (EP) professionals (physicians, scientists, and allied professionals) across the globe. The survey was active from March 27 to April 13, 2020. RESULTS: A total of 1197 respondents completed the survey with 50% of respondents from outside the USA, representing 76 countries and 6 continents. Of respondents, 905 (76%) reported having COVID-19-positive patients in their hospital. Atrial fibrillation was the most commonly reported tachyarrhythmia whereas severe sinus bradycardia and complete heart block were the most common bradyarrhythmias. Ventricular tachycardia/ventricular fibrillation arrest and pulseless electrical activity were reported by 4.8% and 5.6% of respondents, respectively. There were 140 of 631 (22.2%) respondents who reported using anticoagulation therapy in all COVID-19-positive patients who did not otherwise have an indication. One hundred fifty-five of 498 (31%) reported regular use of hydroxychloroquine/chloroquine (HCQ) + azithromycin (AZM); concomitant use of AZM was more common in the USA. Sixty of 489 respondents (12.3%) reported having to discontinue therapy with HCQ + AZM due to significant QTc prolongation and 20 (4.1%) reported cases of Torsade de Pointes in patients on HCQ/chloroquine and AZM. Amiodarone was the most common antiarrhythmic drug used for ventricular arrhythmia management. CONCLUSIONS: In this global survey of &gt; 1100 EP professionals regarding hospitalized COVID-19 patients, a variety of arrhythmic manifestations were observed, ranging from benign to potentially life-threatening. Observed adverse events related to use of HCQ + AZM included prolonged QTc requiring drug discontinuation as well as Torsade de Pointes. Large prospective studies to better define arrhythmic manifestations as well as the safety of treatment strategies in COVID-19 patients are warranted.",20200604,,, 
"479503","Correction: Should Clinicians Use Chloroquine or Hydroxychloroquine Alone or in Combination With Azithromycin for the Prophylaxis or Treatment of COVID-19?","","Ann Intern Med;2020 May 26. ","Ann. intern. med","MEDLINE","article","en","2020","","US","https://dx.doi.org/10.7326/L20-0684","",20200603,,, 
"437834","An update on therapeutic repurposing strategies for COVID-19","Katakam, P.; Adiki, S. K.; Assaleh, F. H.; Ahmed, M. M.","Indo Global Journal of Pharmaceutical Sciences;10(1):Dec-18, 2020.","Indo Global Journal of Pharmaceutical Sciences","COVIDWHO","article","","2020","","","https://doi.org/10.35652/IGJPS.2020.10102","The severe acute respiratory syndrome coronavirus 2, well known as COVID-19 has become the current health distress to the entire world  In the pandemic scenario the research on the rapid development of new drug molecules is highly risky and tedious process  The current COVID-19 emergency demands an urgent development of possible strategies to protect people at high risk of infection and hence the drug repurposing became an emerging approach to fight COVID-19  This review summarizes an update on various therapeutic strategies with special attention on repurposing of drugs to fight against SARS-CoV-2 worldwide  The investigation of existing drugs for new therapeutic purposes is one line of scientific research followed to develop safe and effective COVID-19 treatments  Broad-spectrum antiviral agents (BSAAs) that have been believed to be safe through testing on early phase clinical trials have been hyped as good drug repurposing candidates  Broad-spectrum antiviral drugs such as Ribavirin, Umifenovir were advised for COVID-19 treatment  Some antibiotics may be repurposed as COVID-19 treatments such as teicoplanin, oritavancin, dalbavancin, monensin and azithromycin  Ivermectin an antiparasitic is recently repurposed  Hydroxychloroquine and chloroquine, having immunomodulating effect on humans, have been shown to have antiviral activity at starting and post-entry stages of the SARS-CoV-2 infection  There is a need for global health emergency to call for a courageous, global response at the political and governmental levels  Therefore, the regulatory agencies must act swiftly to lessen any financial obstacles involving private companies and update guidelines for drug licenses by repurposing if necessary",20200601,,,10.35652/IGJPS.2020.10102 
"436525","Azithromycin Should Not Be Used To Treat COVID-19","Lighter, Jennifer; Raabe, Vanessa","Open Forum Infectious Diseases;2020.","Open Forum Infectious Diseases","COVIDWHO","article","","2020","","","https://doi.org/10.1093/ofid/ofaa207","",20200601,,,10.1093/ofid/ofaa207 
"437630","Hidroxicloroquina y azitromicina: riesgo cardiovascular, prolongación de QTc y muerte súbita en el nuevo escenario de la pandemia por COVID-19/ Hydroxychloroquine and azithromycin: cardiovascular risk, QTc prolongation and sudden death in the new COVID-19 outbreak","Barja, Luis D; Maurice, Mario Fitz; González, Elibet Chávez","CorSalud;12(1)ene.-mar. 2020.","CorSalud","LILACS","article","es","2020","Humans; Long QT Syndrome/etiology; Coronavirus Infections/drug therapy; Azithromycin/administration &amp;amp; dosage; Death, Sudden/etiology; Hydroxychloroquine/administration &amp;amp; dosage; Chloroquine/administration &amp;amp; dosage; Risk Factors; Ritonavir/administration &amp;amp; dosage; Lopinavir/administration &amp;amp; dosage","CU","http://www.revcorsalud.sld.cu/index.php/cors/article/view/601/1108","",20200601,12,1, 
"437398","The association between treatment with heparin and survival in patients with Covid-19.","Ayerbe, Luis; Risco, Carlos; Ayis, Salma","J Thromb Thrombolysis;2020 May 31. ","J. thromb. thrombolysis","MEDLINE","article","en","2020","","NL","https://dx.doi.org/10.1007/s11239-020-02162-z","This study investigates the association between the treatment with heparin and mortality in patients admitted with Covid-19. Routinely recorded, clinical data, up to the 24th of April 2020, from the 2075 patients with Covid-19, admitted in 17 hospitals in Spain between the 1st of March and the 20th of April 2020 were used. The following variables were extracted for this study: age, gender, temperature, and saturation of oxygen on admission, treatment with heparin, hydroxychloroquine, azithromycin, steroids, tocilizumab, a combination of lopinavir with ritonavir, and oseltamivir, together with data on mortality. Multivariable logistic regression models were used to investigate the associations. At the time of collecting the data, 301 patients had died, 1447 had been discharged home from the hospitals, 201 were still admitted, and 126 had been transferred to hospitals not included in the study. Median follow up time was 8 (IQR 5-12) days. Heparin had been used in 1734 patients. Heparin was associated with lower mortality when the model was adjusted for age and gender, with OR (95% CI) 0.55 (0.37-0.82) p = 0.003. This association remained significant when saturation of oxygen &lt; 90%, and temperature &gt; 37 °C were added to de model with OR 0.54 (0.36-0.82) p = 0.003, and also when all the other drugs were included as covariates OR 0.42 (0.26-0.66) p &lt; 0.001. The association between heparin and lower mortality observed in this study can be acknowledged by clinicians in hospitals and in the community. Randomized controlled trials to assess the causal effects of heparin in different therapeutic regimes are required.",20200601,,, 
"436952","Hydroxychloroquine and azithromycin as a treatment of COVID-19.","Fanin, Alice; Calegari, Jessica; Beverina, Anna; Tiraboschi, Silvia","Intern Emerg Med;2020 May 30. ","Intern. emerg. med","MEDLINE","article","en","2020","","IT","https://dx.doi.org/10.1007/s11739-020-02388-y","",20200601,,, 
