ID,Title,Authors,Source,Journal,Database,Type,Language,Publication year,Descriptor(s),Publication Country,Fulltext URL, Abstract,Entry Date,Volume number,Issue number,DOI
"613495","ADL-dependency, D-Dimers, LDH and absence of anticoagulation are independently associated with one-month mortality in older inpatients with Covid-19","Bousquet, Guilhem; Falgarone, Géraldine; Deutsch, David; Derolez, Sophie; Lopez-Sublet, Marilucy; Goudot, François-Xavier; Amari, Khadaoudj; Uzunhan, Yurdagul; Bouchaud, Olivier; Pamoukdjian, Frédéric","Aging;12, 2020.","Aging","COVIDWHO","article","","2020","","","https://doi.org/10.18632/aging.103583","BACKGROUND: To assess factors associated with one-month mortality among older inpatients with Covid-19  RESULTS: The mean age was 78 ± 7 8 years, 55 5% were men, CT scan lung damage was observed in 76% of the patients (mild 23%, moderate 38%, extensive 22%, and severe 7%)  The mortality rate was 26%  Dependency/Activities of Daily Living (ADL) score ≤ 5/6, D-Dimers, LDH, and no anticoagulation by reference for curative were independently associated with one-month mortality  A score derived from the multivariate model showed good calibration and very good discrimination (Harrell&#039;s C index [95%CI] = 0 83 [0 79-0 87])  CONCLUSION: ADL-dependency, high serum levels of D-Dimers and LDH and the absence of anticoagulation were independently associated with one-month mortality among older inpatients with Covid-19  METHODS: 108 consecutive older inpatients aged 65 and over with Covid-19 confirmed by RT-PCR and/or typical CT chest scan were prospectively included in a French single-centre cohort study from March to April 2020  A systematic geriatric assessment was performed  Covariates were lymphocyte count, serum levels of albumin, C-Reactive Protein, D-Dimers and Lactate Dehydrogenase (LDH), anticoagulation level, and exposure to the hydroxychloroquine and azithromycin combined therapy  Cox uni- and multivariate proportional-hazard regressions were performed to identify predictors of one-month mortality",20200625,,,10.18632/aging.103583 
"612733","Targeting lymphocyte Kv1.3-channels to suppress cytokine storm in severe COVID-19: Can it be a novel therapeutic strategy?","Kazama, Itsuro","Drug Discoveries &amp; Therapeutics;2020.","Drug Discoveries &amp; Therapeutics","COVIDWHO","article","","2020","","","https://doi.org/10.5582/ddt.2020.03046","In the midst of a pandemic, finding effective treatments for coronavirus disease 2019 (COVID-19) is the urgent issue  In &quot;chronic inflammatory diseases&quot;, the overexpression of delayed rectifier K+-channels (Kv1 3) in leukocytes is responsible for the overactivation of cellular immunity and the subsequent cytokine storm  In our previous basic studies, drugs including chloroquine and azithromycin strongly suppressed the channel activity and pro-inflammatory cytokine production from lymphocytes  These findings suggest a novel pharmacological mechanism by which chloroquine, with or without azithromycin, is effective for severe cases of COVID-19, in which the overactivation of cellular immunity and the subsequent cytokine storm are responsible for the pathogenesis",20200625,,,10.5582/ddt.2020.03046 
"612713","Tocilizumab in patients with severe COVID-19: a retrospective cohort study","Guaraldi, Giovanni; Meschiari, Marianna; Cozzi-Lepri, Alessandro; Milic, Jovana; Tonelli, Roberto; Menozzi, Marianna; Franceschini, Erica; Cuomo, Gianluca; Orlando, Gabriella; Borghi, Vanni; Santoro, Antonella; Di Gaetano, Margherita; Puzzolante, Cinzia; Carli, Federica; Bedini, Andrea; Corradi, Luca; Fantini, Riccardo; Castaniere, Ivana; Tabbì, Luca; Girardis, Massimo; Tedeschi, Sara; Giannella, Maddalena; Bartoletti, Michele; Pascale, Renato; Dolci, Giovanni; Brugioni, Lucio; Pietrangelo, Antonello; Cossarizza, Andrea; Pea, Federico; Clini, Enrico; Salvarani, Carlo; Massari, Marco; Viale, Pier Luigi; Mussini, Cristina","The Lancet Rheumatology;2020.","The Lancet Rheumatology","COVIDWHO","article","","2020","","","https://doi.org/10.1016/S2665-9913(20)30173-9","Summary Background No therapy is approved for COVID-19 pneumonia  The aim of this study was to assess the role of tocilizumab in reducing the risk of invasive mechanical ventilation and death in patients with severe COVID-19 pneumonia who received standard of care treatment  Methods This retrospective, observational cohort study included adults (≥18 years) with severe COVID-19 pneumonia who were admitted to tertiary care centres in Bologna and Reggio Emilia, Italy, between Feb 21 and March 24, 2020, and a tertiary care centre in Modena, Italy, between Feb 21 and April 30, 2020  All patients were treated with the standard of care (ie, supplemental oxygen, hydroxychloroquine, azithromycin, antiretrovirals, and low molecular weight heparin), and a non-randomly selected subset of patients also received tocilizumab  Tocilizumab was given either intravenously at 8 mg/kg bodyweight (up to a maximum of 800 mg) in two infusions, 12 h apart, or subcutaneously at 162 mg administered in two simultaneous doses, one in each thigh (ie, 324 mg in total), when the intravenous formulation was unavailable  The primary endpoint was a composite of invasive mechanical ventilation or death  Treatment groups were compared using Kaplan-Meier curves and Cox regression analysis after adjusting for sex, age, recruiting centre, duration of symptoms, and baseline Sequential Organ Failure Assessment (SOFA) score  Findings Of 1351 patients admitted, 544 (40%) had severe COVID-19 pneumonia and were included in the study  57 (16%) of 365 patients in the standard care group needed mechanical ventilation, compared with 33 (18%) of 179 patients treated with tocilizumab (p=0·41;16 [18%] of 88 patients treated intravenously and 17 [19%] of 91 patients treated subcutaneously)  73 (20%) patients in the standard care group died, compared with 13 (7%;p&amp;lt;0·0001) patients treated with tocilizumab (six [7%] treated intravenously and seven [8%] treated subcutaneously)  After adjustment for sex, age, recruiting centre, duration of symptoms, and SOFA score, tocilizumab treatment was associated with a reduced risk of invasive mechanical ventilation or death (adjusted hazard ratio 0·61, 95% CI 0·40–0·92;p=0·020)  24 (13%) of 179 patients treated with tocilizumab were diagnosed with new infections, versus 14 (4%) of 365 patients treated with standard of care alone (p&amp;lt;0·0001)  Interpretation Treatment with tocilizumab, whether administered intravenously or subcutaneously, might reduce the risk of invasive mechanical ventilation or death in patients with severe COVID-19 pneumonia  Funding None",20200625,,,10.1016/S2665-9913(20)30173-9 
"612561","Potential Benefits of Combination of Nigella sativa and Zn Supplements to Treat COVID-19","Rahman, Mohammad Tariqur","Journal of Herbal Medicine;2020.","Journal of Herbal Medicine","COVIDWHO","article","","2020","","","https://doi.org/10.1016/j.hermed.2020.100382","An effective vaccine to prevent the SARS-CoV-2 causing COVID-19 is yet to be approved  Further there is no drug that is specific to treat COVID-19  A number of antiviral drugs such as Ribavirin, Remdesivir, Lopinavir/ritonavir, Azithromycin and Doxycycline have been recommended or are being used to treat COVID-19 patients  In addition to these drugs, rationale and evidence have been presented to use chloroquine to treat COVID-19, arguably with certain precautions and criticism  In line with the proposed use of chloroquine, Nigella sativa (black seed) could be considered as a natural substitute that contains a number of bioactive components such as thymoquinone, dithymoquinone, thymohydroquinone, and nigellimine  Further benefits to use N  sativa could be augmented by Zn supplement  Notably, Zn has been proven to improve innate and adaptive immunity in the course of any infection, be it by pathogenic virus or bacteria  The effectiveness of the Zn salt supplement could also be enhanced with N  sativa as its major bioactive component might work as ionophore to allow Zn2+ to enter pneumocytes - the target cell for SARSCoV-2  Given those benefits, this review paper describes how N  sativa in combination with Zn could be useful as a complement to COVID-19 treatment",20200625,,,10.1016/j.hermed.2020.100382 
"610558","Placental transfer and safety in pregnancy of medications under investigation to treat COVID-19","Louchet, Margaux; Sibiude, Jeanne; Peytavin, Gilles; Picone, Olivier; Tréluyer, Jean-Marc; Mandelbrot, Laurent","American Journal of Obstetrics &amp; Gynecology MFM;2020.","American Journal of Obstetrics &amp; Gynecology MFM","COVIDWHO","article","","2020","","","https://doi.org/10.1016/j.ajogmf.2020.100159","Background Treatment of COVID-19 is mostly symptomatic, but a wide range of medications are under investigation against SARS-CoV-2  Although pregnant women are excluded from clinical trials, they will inevitably receive therapies whenever they appear effective in non-pregnant patients and even under compassionate use  Method We conducted a review of the literature on placental transfer and pregnancy safety data of drugs under current investigation for COVID-19  Results Regarding remdesivir, there are no data in pregnant women  Several other candidates already have safety data in pregnant women, since they are repurposed drugs already used for their established indications  They may thus be used in pregnancy, although their safety in the context of COVID-19 may differ from conventional use  These include the HIV protease inhibitors such as lopinavir/ritonavir which have low placental transfer;interferon which does not cross the placental barrier, and (hydroxy) chloroquine, which have high placental transfer  There are also pregnancy safety and placental transfer data for colchicine, steroids, oseltamivir and azithromycin, as well as some monoclonals  However, some drugs are strictly prohibited in pregnancy due to known teratogenicity (thalidomide) or fetal toxicities (renin-angiotensin system blockers)  Other candidates including tocilizumab and other IL-6 inhibitors, umifenovir and favipiravir have insufficient data on pregnancy outcomes  Conclusion In life-threatening cases of COVID-19, the potential risks of therapy to the fetus may be more than offset by the benefit of curing the mother  While preclinical and placental transfer studies are required for a number of potential anti-SARS CoV2 drugs, several medications can already be used in pregnant women",20200623,,,10.1016/j.ajogmf.2020.100159 
"610020","Tocilizumab for treatment of patients with severe COVID–19: A retrospective cohort study","Kewan, Tariq; Covut, Fahrettin; Al–Jaghbeer, Mohammed J.; Rose, Lori; Gopalakrishna, K. V.; Akbik, Bassel","EClinicalMedicine;2020.","EClinicalMedicine","COVIDWHO","article","","2020","","","https://doi.org/10.1016/j.eclinm.2020.100418","Background Tocilizumab was approved for chimeric antigen receptor T–cell therapy induced cytokine release syndrome and it may provide clinical benefit for selected COVID–19 patients  Methods In this retrospective cohort study, we analyzed hypoxic COVID–19 patients who were consecutively admitted between March 13, 2020 and April 19, 2020  Patients with lung infiltrates and elevated inflammatory markers received a single dose of tocilizumab if no contraindication was present  Systemic steroid, hydroxychloroquine, and azithromycin were concomitantly used for majority of the patients  Findings Of the 51 patients included for analysis, 28 (55%) received tocilizumab and 23 (45%) did not receive tocilizumab  Tocilizumab cohort required more invasive ventilation (68% vs  22%) at baseline and during entire hospitalization (75% vs  48%)  The median time to clinical improvement in tocilizumab vs  no tocilizumab cohorts was 8 days (Interquartile range [IQR]: 6·25 – 9·75 days) vs  13 days (IQR: 9·75 – 15·25 days) among patients who required mechanical ventilation at any time (Hazard ratio for clinical improvement: 1·83, 95% confidence interval [CI]: 0·57 – 5·84) and 6·5 days vs  7 days among all patients (Hazard ratio for clinical improvement: 1·14, 95% CI: 0·55 – 2·38), respectively  The median duration of vasopressor support and invasive mechanical ventilation were 2 days (IQR: 1·75 – 4·25 days) vs  5 days (IQR: 4 – 8 days), p = 0 039, and 7 days (IQR: 4 – 14 days) vs  10 days (IQR: 5 – 15 days) in tocilizumab vs  no tocilizumab cohorts, p = 0 11, respectively  Similar rates of hospital–acquired infections occurred in both cohorts (18% in tocilizumab and 22% in no tocilizumab cohort)  Interpretation In patients with severe COVID-19, tocilizumab was associated with significantly shorter duration of vasopressor support  Although not statistically significant, tocilizumab also resulted in shorter median time to clinical improvement and shorter duration of invasive ventilation  These findings require validation from ongoing clinical trials of Tocilizumab in COVID–19 patients",20200622,,,10.1016/j.eclinm.2020.100418 
"32551892","Update Alert: Should Clinicians Use Chloroquine or Hydroxychloroquine Alone or in Combination With Azithromycin for the Prophylaxis or Treatment of COVID-19? Living Practice Points From the American College of Physicians.","Qaseem, Amir; Yost, Jennifer; Etxeandia-Ikobaltzeta, Itziar; Miller, Matthew C; Abraham, George M; Obley, Adam J; Forciea, Mary Ann; Jokela, Janet A; Humphrey, Linda L","Ann Intern Med;2020 Jun 17. ","Ann. intern. med","MEDLINE","article","en","2020","","US","https://dx.doi.org/10.7326/M20-3862","",20200622,,, 
"32554424","Cerebral Venous Thrombosis Associated with COVID-19.","Cavalcanti, D D; Raz, E; Shapiro, M; Dehkharghani, S; Yaghi, S; Lillemoe, K; Nossek, E; Torres, J; Jain, R; Riina, H A; Radmanesh, A; Nelson, P K","AJNR Am J Neuroradiol;2020 Jun 18. ","AJNR am. j. neuroradiology","MEDLINE","article","en","2020","","US","https://dx.doi.org/10.3174/ajnr.A6644","Despite the severity of coronavirus disease 2019 (COVID-19) being more frequently related to acute respiratory distress syndrome and acute cardiac and renal injuries, thromboembolic events have been increasingly reported. We report a unique series of young patients with COVID-19 presenting with cerebral venous system thrombosis. Three patients younger than 41 years of age with confirmed Severe Acute Respiratory Syndrome coronavirus 2 (SARS-Cov-2) infection had neurologic findings related to cerebral venous thrombosis. They were admitted during the short period of 10 days between March and April 2020 and were managed in an academic institution in a large city. One patient had thrombosis in both the superficial and deep systems; another had involvement of the straight sinus, vein of Galen, and internal cerebral veins; and a third patient had thrombosis of the deep medullary veins. Two patients presented with hemorrhagic venous infarcts. The median time from COVID-19 symptoms to a thrombotic event was 7 days (range, 2-7 days). One patient was diagnosed with new-onset diabetic ketoacidosis, and another one used oral contraceptive pills. Two patients were managed with both hydroxychloroquine and azithromycin; one was treated with lopinavir-ritonavir. All patients had a fatal outcome. Severe and potentially fatal deep cerebral thrombosis may complicate the initial clinical presentation of COVID-19. We urge awareness of this atypical manifestation.",20200622,,, 
"32562159","The clinical value of two combination regimens in the Management of Patients Suffering from Covid-19 pneumonia: a single centered, retrospective, observational study.","Vahedi, Ensieh; Ghanei, Mostafa; Ghazvini, Ali; Azadi, Hossein; Izadi, Morteza; Panahi, Yunes; Fathi, Saeid; Salesi, Mahmood; Saadat, Seyed Hassan; Ghazale, Amir Hossein; Rezapour, Mohammad; Mozafari, Abolfazl; Zand, Nahid; Parsaei, Mohammadreza Raesi; Ranjkesh, Mohammad Hossein; Jafari, Ramezan; Movaseghi, Fatemeh; Darabi, Enayat","Daru;2020 Jun 19. ","","MEDLINE","article","en","2020","","CH","https://dx.doi.org/10.1007/s40199-020-00353-w","BACKGROUND: There is no identified pharmacological therapy for COVID-19 patients, where potential therapeutic strategies are underway to determine effective therapy under such unprecedented pandemic. Therefore, combination therapies may have the potential of alleviating the patient&#039;s outcome. This study aimed at comparing the efficacy of two different combination regimens in improving outcomes of patients infected by novel coronavirus (COVID-19). METHODS: This is a single centered, retrospective, observational study of 60 laboratory-confirmed COVID-19 positive inpatients (&amp;#8805;18 years old) at two wards of the Baqiyatallah Hospital, Tehran, Iran. Patient&#039;s data including clinical and laboratory parameters were recorded. According to the drug regimen, the patients were divided into two groups; group I who received regimen I consisting azithromycin, prednisolone, naproxen, and lopinavir/ritonavir and group II who received regimen II including meropenem, levofloxacin, vancomycin, hydroxychloroquine, and oseltamivir. RESULTS: The oxygen saturation (SpO2) and temperature were positively changed in patients receiving regimen I compared to regimen II (P = 0.013 and P = 0.012, respectively). The serum level of C-reactive protein (CRP) changed positively in group I (P &lt; 0.001). Although there was a significant difference in platelets between both groups (75.44 vs 51.62, P &lt; 0.001), their change did not clinically differ between two groups. The findings indicated a significant difference of the average length of stay in hospitals (ALOS) between two groups, where the patients under regimen I showed a shorter ALOS (6.97 vs 9.93, P = 0.001). CONCLUSION: This study revealed the beneficial effect of the short-term use of low-dose prednisolone in combination with azithromycin, naproxen and lopinavir/ritonavir (regimen I), in decreasing ALOS compared to regimen II. Since there is still lack of evidence for safety of this regimen, further investigation in our ongoing follow-up to deal with COVID-19 pneumonia is underway. Graphical abstract.",20200622,,, 
"PMC7298480","Ethical issues related to the hydroxychloroquine treatment prescription for Covid-19","Rhazi, Karima El; Adarmouch, Latifa","Ethics Med Public Health;2020.","Ethics Med Public Health","COVIDWHO","article","","2020","","","https://doi.org/10.1016/j.jemep.2020.100547","The 2019-20 coronavirus pandemic (COVID-19), has led to severe acute respiratory syndrome coronavirus 2 (SARS-CoV-2)  To date, no drugs have demonstrated safety and efficacy in randomized controlled trials for patients with COVID-19  Although the association between Hydroxychloroquine and Azithromycin efficacy lack of solid evidence-base, several governments have adopted it for all virology confirmed Covid-19 cases even for those who are asymptomatic  In the following, we aim to discuss some of the ethical issues associated with the use of this treatment association  We mainly tried to discuss the following controversial questions: Is it ethical not to treat a patient while a treatment exists and is used for other indications than Covid-19 for which it’s not proven yet? If yes, is a randomized controlled trial to prove the hydroxychloroquine for the Covid-19 treatment, necessary, in the context of covid-19 pandemic? If No, is it the government’s right to decide the hydroxychloroquine treatment for all covid-19 patients? and what should be the physicians’ attitudes? Finally, what are the government, physicians, and patient’s rights and responsibilities? The paper conclude that, since health authorities in some countries recommended this off-label use treatment, physicians are challenged by the requirement of veracity while providing care to their patients and the implications of such a requirement;they are facing the challenge of balancing this guideline and their own conviction  Furthermore, the fundamental principles of beneficence and non-maleficence, and respect for persons should underlie any reflection process to address this dilemma  In addition, in a pandemic context, the limits between the government’s, practitioner’s and patient’s rights and obligations are not clear which could significantly endanger the universal ethical principles in clinical practice  It could also undermine any attempt to develop serious clinical trials to prove the considered off-label drug",20200619,,,10.1016/j.jemep.2020.100547 
"32550056","Pathological Findings and Management of COVID-19 Patients: A Brief Overview of Modern-day Pandemic","Mian, M. S.; Razaq, L.; Khan, S.; Hussain, N.; Razaq, M.","Cureus;12(5):e8136, 2020.","Cureus","COVIDWHO","article","","2020","","","https://doi.org/10.7759/cureus.813610.7759/cureus.8136.","Today the world is facing one of the deadliest pandemics caused by COVID-19  This highly transmissible virus has an incubation period of 2 to 14 days  It acts by attaching to the angiotensin-converting enzyme (ACE2) with the help of glycoprotein spikes, which it uses as a receptor  Real-time polymerase chain reaction (PCR;rt-PCR) is the gold standard diagnostic test, and chest X-ray and computed tomography (CT) scan are the other main investigations  Several medications and passive immunization are in use to treat the condition  We searched using PubMed and Google Scholar using keywords such as COVID-19, coronavirus, and their combination with pathological findings, clinical features, management, and treatment to search for relevant published literature  After the removal of duplications and the selection of only published English literature from the past five years, we had a total of 31 papers to review  Most of the COVID-19 affected patients have mild pneumonia symptoms, and those with severe disease have comorbidities  Patients with COVID-19 had pathological findings, like ground-glass opacities, consolidations, pleural effusion, lymphadenopathy, and interstitial infiltration of inflammatory cells  Radiological changes show lung changes such as consolidations and opacities, and the pathological findings were infiltration of inflammatory cells and hyalinization  Patients with mild symptoms should self-quarantine, whereas those with severe acute respiratory distress syndrome (ARDS) are treated in the hospital  Medications under trial include antivirals, antibacterials, antimalarials, and passive immunization  Supportive treatment such as oxygen therapy, extracorporeal membrane oxygenation, and ventilator support can also be used  The symptoms shown by patients are very mild and self-limiting  There is no definitive treatment, although a combination of hydroxychloroquine and azithromycin have shown good results, and passive immunization also shows promising results, their safety profile is yet to be studied in detail",20200619,,,10.7759/cureus.813610.7759/cureus.8136. 
"PMC7296879","Humidifier Use and Prone Positioning in a Patient with Severe COVID-19 Pneumonia and Endotracheal Tube Impaction Due to Highly Viscous Sputum","Sugimoto, Ryu; Kenzaka, Tsuneaki; Fujikawa, Moemi; Kawasaki, Satoru; Nishisaki, Hogara","Cureus;12(6):e8626, 2020.","Cureus","COVIDWHO","article","","2020","","","https://doi.org/10.7759/cureus.8626","COVID-19 can lead to severe pneumonia, requiring mechanical ventilation  While increased sputum secretion could cause airway obstruction during mechanical ventilation, there are few reported cases in the literature  We report a case of a 65-year-old man with diabetes and severe COVID-19 pneumonia requiring mechanical ventilation and treated with hydroxychloroquine, azithromycin, nafamostat, and prone positioning  Initially, mechanical ventilation consisted of a heat moisture exchanger, endotracheal tube aspiration, and subglottic secretion drainage using a closed suction system  However, endotracheal tube impaction by highly viscous sputum occurred during this mechanical ventilation system  Replacing the endotracheal tube, the use of a humidifier instead of a heat moisture exchanger, and prone positioning contributed to the patient being weaned off mechanical ventilation  Although anti-aerosol measures are important for severe COVID-19 pneumonia, attention should be given to potential endotracheal tube impaction during mechanical ventilation",20200618,,,10.7759/cureus.8626 
"603311","Potenciales efectos pro-arrítmicos de la farmacoterapia contra SARS-CoV-2","Medeiros-Domingo, Argelia; Carrasco, Omar F.; Berni-Betancourt, Ana","Arch Cardiol Mex;90(Supl):36-40, 2020.","Arch Cardiol Mex","COVIDWHO","article","","2020","","","","The pandemic caused by the SARS-COV-2 or COVID-19 virus has been a global challenge given its high rate of transmission and lack of effective therapy or vaccine  This scenario has led to the use of various drugs that have demonstrated a potential effect against the virus in vitro  However, time has not been enough to properly evaluate their clinical effectiveness  The use of chloroquine/hydroxychloroquine, azithromycin and antiviral treatment and has been proposed by various groups, supported by in-vitro studies and limited patient series, without the adequate scientific rigor that precedes drug prescription  Although it may represent the only hope for many patients, it is important to know the main adverse effects associated with the use of these drugs and to better select patients who may benefit from them",20200618,,, 
